3/16/2018,Amazon,5,This new trimmer is awesome! It's compact but not too small for my ...,"I bought this mainly because my last beard trimmer was a Remington and it lasted me nearly 10 years. This new trimmer is awesome! It's compact but not too small for my large hands. I like the two speeds, although I really only use the fastest speed (not sure why you would need the slow speed). The nose trimmer is...interesting, but I did use it and it didn't cut me or anything so that's a win! The beard trimmer slider thing works well too. It's a bit difficult to choose the correct length setting, but once you get it locked in it does stay without sliding. I hope this trimmer lasts me years and years like the last one because I like it a lot!"
3/21/2018,Amazon,5,Best trimmer/clippers I have ever,Arrived early. Best trimmer/clippers I have ever owned
3/26/2018,Amazon,5,Five Stars,Works Shockingly well. grabbed it on sale but would get it again at regular price
3/27/2018,Amazon,2,Worked well for about a year,"Used this every two weeks to trim my beard for the past year.  The device itself still works well and holds a charge, but the large guard that came with it was made out of cheap plastic and broke.  I can still use it for some things, but not trimming my beard.  Make the guards as sturdy as the trimmer or it’s worthless unless you want a buzz cut."
3/29/2018,Amazon,5,Great little machine,Great little machine. Does everything for men grooming. Easy on and off attachments. Works well with each attachment I have used.
3/31/2018,Amazon,5,Five Stars,"Perfect! Good quality, thank you."
4/1/2018,Amazon,3,Nice for short cuts-trimming-not for longer cuts-and overpriced,Too small-doesn’t have enough clippers for a longer cut so huge disappointment. It IS good for short cuts and trimming though-so for that I would give it 5 stars.  Pic is taken about a week after cut but shows its pretty good
4/1/2018,Amazon,2,A disappointment,"The detail foil shaver began to malfunction after the first shave. I opened it to remove the hair within and put it back together. It now makes a terrible rattling sound and doesn't work anymore.  I haven't tried the nose, ear and eyebrow trimmer as it looks very unsafe.The blades are exposed and I'm not putting it anywhere near to my body."
4/2/2018,Amazon,5,5 stars,Nice kit for a new Beardster
4/4/2018,Amazon,5,Five Stars,Works great!
4/6/2018,Amazon,5,Perfect for all trimming needs,"Love the quality, good product."
4/6/2018,Amazon,1,One Star,Dead after 4 months.
4/7/2018,Amazon,5,Better than my 200 Whal professional clippers,Better than my 200 Whal professional clippers.  Battery life is excellent.  Will literally go over a month on a single charge.
4/8/2018,Amazon,4,Pros and Cons of Remington PG6170,"Since I groom a lot, I thought of a walkthrough of the pros and cons of this product. Pros: > Value for the money > Nice grip and above average built quality > Comes with a pouch for all the accessories > Waterproof  Cons > Cheap quality accessories. > Hard to get sharp edges while grooming  It's a nice beginner level grooming kit."
4/9/2018,Amazon,5,I was pleasantly surprised by how powerful it is. ...,"I was pleasantly surprised by how powerful it is. A lot of cordless trimmers are a bit weak. I am not likely to use all the various accessories and attachments, but it provides a lot of those if you want them."
4/11/2018,Amazon,1,One Star,skin cuts
4/11/2018,Amazon,3,"Works well, not sure i'll get the life expectancy I would like.","I've used this for about two years and it still works, but definitely shows the use. I have not been able to find a beard trimmer that exceeds the 2-3 year life span and I'm not sure if this one will make that cut."
4/13/2018,Amazon,4,Four Stars,"Returned it, ordered wrong"
4/14/2018,Amazon,1,The 5-minute quick charge is not true! It’s been ...,The 5-minute quick charge is not true! It’s been charging for more than 15 minuntes now and still no response!
4/15/2018,Amazon,1,5 Months...,"5, ONLY 5 months did this trimmer last me. Although, it worked as advertised during those short 5 months, only look into this trimmer if you're to make a short term investment. It now decides to turn on by itself at various hours in the night or day or day hilariously vibrate it's way arround my bathroom sink. It turns on and off on it's own while pinching the hair on my face. This is definitely a no go for anyone that's going to be shaving with it forore than half a year."
4/16/2018,Amazon,5,... changer for those with sensitive faces or those who hate shaving with a razor,Life changer for those with sensitive faces or those who hate shaving with a razor.
4/17/2018,Amazon,4,"Cuts very well, lots of useful accessories","For many years I used a Philips beard trimmer with a vacuum, but my second one died so I decided to try this Remington. It does cut very well - the blades move faster than the Philips did - but I do miss the vacuum feature. I use one of the fixed-depth combs which works well for me, though the adjustable comb clicks securely into place. I also appreciate and use the small trimmer (for my mustache) and the ear/nose trimmer. It's also nice that a carry bag is included.  The only thing I don't like is that the trimmer will not run if the AC cord is connected and plugged in, but that's a minor gripe. It supposedly charges quickly."
4/19/2018,Amazon,1,Very Poor Quality,"Purchased this item at the end of Feb. 2018. It is half-way through April, and it is making a noise that would preclude anyone from putting it anywhere near their face. You get what you pay for."
4/24/2018,Amazon,5,Five Stars,Does a nice job of trimming and is well made.
4/24/2018,Amazon,5,Five Stars,Husband loved it.. Works wonderful and does everything he needs it to do.
4/27/2018,Amazon,4,I liked that its waterproof,"I liked that its waterproof, but Norelco had made the bodygroom, which had a microscreen which was more similar to a close shave. Everything else is great.. Nice if it had a stand as well."
4/28/2018,Amazon,5,Five Stars,husband loves it
4/29/2018,Amazon,4,Works great,It works great and the attachment selection is nice.  The only thing I'd like to see changed is the ability to run it plugged in and not have to make sure it's charged each time.
5/5/2018,Amazon,5,Good trimmer.,works fine.
5/6/2018,Amazon,2,All great except for the the plastic on top that controls the length which can easily go shorter by accident while you trim,The trimmer itself works fine and the battery last long but the plastic on top that you use to choose the length is poorly designed... It doesn't hold well and while I was shaving as usual with length 12 it suddenly pushed inside and got me a short square on my beard... Very unpleasant! Now I really need to hold it carefully with my hand because it is really loose.
5/7/2018,Amazon,5,Five Stars,good product and even better deal on prime day
5/10/2018,Amazon,5,"he absolutely love it, especially that it comes with a bag ...","Bought this for my boyfriend, he absolutely love it, especially that it comes with a bag for all of it to go in!"
5/13/2018,Amazon,5,Good battery life,"Works really well. My husband is nervous to try it in the shower even though it says it can be used wet&dry. One charge has lasted him 4 trim-ups which last 20-30 minutes each ---and it still hasnt lost it's charge.  The beard/length attachment is really well put together,  it has 2-20 length settings on 1 attachment instead of on a bunch of different ones like I've gotten in the past.  Great buy, would recommend."
5/13/2018,Amazon,5,Great product for the price,Great product for the price! The trimmer and attachments are well built and sturdy. This should easily last a few years. The long/thin trimmer is perfect for the nose and ears! Highly recommend this product to anyone looking for a beard trimmer that can also trim up those nose hairs.
5/14/2018,Amazon,5,Five Stars,Its working good so far.
5/16/2018,Amazon,5,happy with my choice,I have no complaints about this so far. I'm blind and was able to figure everything out and use it how I wanted to with no problem.
5/17/2018,Amazon,2,lasted only 14 months until breaking.,lasted only 14 months until breaking.  brought into the shower twice (advertised as full waterproof) and now on/off button completely dysfunctional after a few day  of turning on and off without reason
5/17/2018,Amazon,5,Works like if should,"My rechargable trimmer died. So I did my research and ordered this one. I also have a Wahl electric trimmer to keep my mostly bald head closely cropped and a nose ear trimmer. I put these two away because the Remmington works so much better. The blades are sharper than the Wahl where several passes were needed with the Wahl and it still missed hairs. All of the attachments work smoothly and go on and off the trimmer easily. The pieces that snap on do so tightly. The Wahl’s fall off constantly. The foil shaver actually works. The ear, nose trimmer doesn’t pull hairs. The detail trimmer can take care of ears like none of the three others I had. It looks nice, feels nice and holds a charge so I don’t have to keep it sitting out on the charger constantly. I put it away until I need it again. And it can also be used in the shower. This was exactly what I was looking for. And I very seldom write a review, especially a positive one!"
5/19/2018,Amazon,5,One of the better kits.,"This is one of the better kits I have had, the trimmer is powerful enough and the attachments useful.  A little molded tray to hold everything would be nice."
5/20/2018,Amazon,5,Five Stars,"Works great, love that it has multiple uses."
5/21/2018,Amazon,3,Three Stars,its okay
5/21/2018,Amazon,2,very good trimmer​ probably will order new one hoping that it ...,"Completly stopped working after 2 months.  Despite this fact, very good trimmer​ probably will order new one hoping that it was one of a kind issue."
5/21/2018,Amazon,1,NOT WATERPROOF BROKE IN 5 months.,Used his product 7 times. Only needed to charge it once. I used this trimmer in the shower to shorten my facial hair before using a razor blade. I bought it for the sole reason it was water proof. The buzzer light burnt out and the buzzer would come on or stay on when I wanted to shut it off. I have charged this product. I don’t believe this product is waterproof.
5/24/2018,Amazon,5,Five Stars,Great clippers
5/24/2018,Amazon,5,and I'm delighted with what I got,"At my age, I've had many beard trimmers from each of the major brands. When my last one stopped taking a charge, I went back on the web and found this Beard Boss model. Made the switch from Wahl to Remington, and I'm delighted with what I got. I've only used it once, but it was easily far superior to my last trimmer. The guides go on/off MUCH easier than with the Wahl, and I'm not worried about breaking them. Others have commented that there's no need for both speeds, but I find that the lower speed was better for me when using the nose hair removal attachment. Can't comment on how long this one will last, because I just got it. But my first impressions are ALL positive. One funny thing: I was trying to register the device on Reminton's webpage and couldn't get it to work for me. Emailed them and got the most refreshingly honest response. In essence, I was told how to do it, but reminded that all I really needed to do was keep the receipt and then a confession: the registration on the web thing is really just a marketing thing. LOL  Anyway - five stars easily on this product. I'm quite pleased."
5/25/2018,Amazon,5,I LOVE IT...,ITS GREAT... I REALLY LOVE IT... IT WORKS SUPER GOOD...  P.V.
5/27/2018,Amazon,2,Broken part,"I went to use the full size trimer for the first time and it wont stick to the muchine, the other attachments work except for the full size trimmer, very displeased."
5/29/2018,Amazon,2,Two Stars,Cheap
5/29/2018,Amazon,5,"... mesh Shaver attachment is worthless but the shears are great, works very well","the micro mesh Shaver attachment is worthless but the shears are great, works very well."
5/29/2018,Amazon,5,Super impressed with the quality of the attachments - also ...,"Super impressed with the quality of the attachments - also the battery lasts a long time.  I use this twice a week to trim my goatee, and I have to recharge it every three months.  This is a great deal for the money!"
5/30/2018,Amazon,5,... the purchase but I was pleasantly surprised it works fantastic. My husband loves ❤,Brought for my husband and I was worried about the purchase but I was pleasantly surprised it works fantastic. My husband loves ❤
6/6/2018,Amazon,5,"Works great, useful attachments, and battery life far exceeds anything else I've tried","I've used shower trimmers for many years - it's so convenient to shave my head and beard in the shower, been doing so for many years. I've been using the Remington since April, and it is far and away the best one I've tried. (The other's I've tried are ok, but have their foibles. They are: Panasonic ER224S Men's Cordless Wet/Dry Hair, Beard and Body Electric Trimmer and Philips Norelco Bodygroom Series 7100, BG2040.)  Outstanding features:  * Battery life far beyond anything else I've tried - lasts several weeks of daily use, always on high speed. And charges very quickly! * It shaves well - never any nicks but shaves close, for a trimmer, and compact, easy to get to where I need. * Nifty attachments - nose and ear trimmer design is really good, works well. I haven't tried the foil head, curious about that. * I found a simple arrangement that gets the length I want for my partial beard, but there's a lot of options including an adjustable head if you need. * Compact - easy to include in my travel kit, even with charging cord (which I usually don't need). * Seems kinda bullet-proof simple. The blade assembly doesn't have space to gather residue, so little or no cleaning is required.  The general quality of operation together with the extreme run between charging, topped off with the compactness and generally fine design and accessories makes it a real win, and this an unreserved recommendation."
6/8/2018,Amazon,5,Impressively quiet,My favorite trimmer so far. I have owned too many to count. Close shave and actually really quiet. The noise output is impressively low. Very happy with my purchase.
6/10/2018,Amazon,5,Five Stars,Works great so far
6/16/2018,Amazon,5,Very Happy,Seems very sturdy. One of the few that had the attachments I was looking for. Charged well. Runs great.
6/18/2018,Amazon,5,Five Stars,I loved this tried out many razers. this was definately the one for me
6/23/2018,Amazon,5,Five Stars,Nice set and still running great! Easy to clean. Doesn't get hot.
6/24/2018,Amazon,5,I like the two speeds,"Very impressive trimmer. I like the two speeds. Very nice grip. I can’t attest to the durability just yet because I have only had it for a couple months, but it seams very well built"
6/25/2018,Amazon,2,"Thought it was nice. now however when ai use it the ""adjustable ...","Thought it was nice. now however when ai use it the ""adjustable comb"" won't lock. It slides . It put a gouge in my beard. Not happy. Have not used it many times. Not good!!"
6/25/2018,Amazon,5,Five Stars,Nice and quiet. Love it!
6/25/2018,Amazon,5,Pretty much the perfect tool for grooming your beard whether ...,Pretty much the perfect tool for grooming your beard whether big or small. Really enjoy the product and would recommend. Great battery life as well.
6/27/2018,Amazon,5,My wife uses it too,Works just as expected. And my wife uses it too...let me just say it gave great results.
6/27/2018,Amazon,5,Great trimmer,Works great
7/4/2018,Amazon,5,just what I needed my other trimmer did not work ...,just what I needed my other trimmer did not work any more so time for a new one and this one as more attachments
7/5/2018,Amazon,3,Three Stars,"the machine works well, but plastic adjustable attachment broke after only a few months.  seriously limits ability to use."
7/7/2018,Amazon,1,"Died in 6 months, Remington not honoring two year warranty","I've had this shaver for less than a year. A few weeks ago, it started to randomly turn itself on. Eventually it drained its battery. It no longer charges or turns on. I contacted Remington for warranty replacement:  Feb 8th, Sent initial warranty claim email Feb 8th, Recv'd response asking for serial # Feb 8th, Sent serial # Feb 11th, Recv'd response asking for name and address Feb 11th, Sent name and address  It is now Feb 23. I have not heard back in 12 days, and it has been 15 since the initial warranty request."
7/10/2018,Amazon,5,"Worthy, but not necessary","I had the cheaper remington version and loved it, however after about 2 years my foil shaver was getting noticeably ""choppy"" so I needed to replace it. I looked around, honestly remington has the two best products so I found myself choosing between that one and this one. In the past two years I have graduated college and have a nice job so I figured I would try the more expensive one. Let me say, it does feel nice. It definitely looks and feels like a mature product. The only useful benefit over the cheaper option is the nose trimmer attachment.  If you do not care about having ""fancy"" looks and the nose trimmer attachment, just get the cheaper one. It is the exact same mostly and lasted me quite some time. If you want an upgraded appearance/feel with the nose trimmer, get this one. Ultimately, I decided it was worth being able to consolidate all my grooming into one tool, and I wanted the more mature look. I do not regret my purchase at all, however I would be content with the cheaper one had this not been in the budget."
7/11/2018,Amazon,5,Five Stars,great buy
7/11/2018,Amazon,5,All-in-one groomer with a lot of versatility,Purchased for my son to trim up his beard and keep it neat and clean.  He loves the versatility of all the different guards.  It is an all-in-one groomer.
7/14/2018,Amazon,3,OK but the adjustable head doen't hold up/,did not take long until the adjustable spacer would no longer stay where you set it.
7/15/2018,Amazon,3,OK for Beards...NOT A RAZOR!,"OK for Beards...NOT A RAZOR! If you want to clean and trip and/or grow a beard, then it is OK. If you want to SHAVE, then NOT recommended! I have a beard and it works well to shape and keep a consistent length BUT to shave my neck or cheek, it SUCKS!!!! Horrible RAZOR for ""skin jobs."""
7/21/2018,Amazon,5,The nose hair trimmer is very good and gets up into the nostril well,"This works well for close trimming my facial hair, and not so close trimming some body hair.  Cuts well, and the battery lasts a long time.  The nose hair trimmer is very good and gets up into the nostril well.  Great value."
7/26/2018,Amazon,5,Best beard clippers I've used,"This thing kicks ass. Best beard clippers I've used, and can even use them while in the shower, since it's water proof. Titanium head on the main set of clippers should last a while. Hopefully the battery gives me very good life holding charges before it needs replacing. Dual settings for normal and fast clipping. Works great on my face and for maintaining my nether regions, which the ladies seem to like. Definitely recommend."
7/28/2018,Amazon,5,3 year battery life! Not too shabby!,Mine lasted 3 years. Great trimmer! Only charged it 6 or 7 times. Love using it in the shower. Only wish the attachments were rubber or metal so they won't break if it slips out of your hand.
7/30/2018,Amazon,1,"This is terrible, doesn’t work, really cheap.","This is terrible, doesn’t work, really cheap."
7/31/2018,Amazon,5,Five Stars,works great
8/2/2018,Amazon,1,Too much heat,"Too much of heat after using it for 5 minutes, I expected a better product"
8/3/2018,Amazon,5,"really loving this, it’s not as loud as my ...","really loving this, it’s not as loud as my other shavers and this has a lot of changeable pieces for all different occasions.  what really got my attention was the smoothness while shaving. one of the smoothest shave i’ve ever had. cleaning is a breeze too."
8/4/2018,Amazon,5,Best ever,I love it. Best one I've ever had.
8/4/2018,Amazon,5,Five Stars,Ecellent
8/6/2018,Amazon,2,Would not charge less than 6 months later,Worked well the first few months but the battery will not charge anymore. Expected more for the price.
8/14/2018,Amazon,4,Four Stars,Good Product. Easy to use.
8/15/2018,Amazon,5,Really does a great job,my grandson is thrilled
8/15/2018,Amazon,4,Very pleased with this trimmer.  Accurate and effective.,"I use this to trim my beard and mustache.  Compared to a Norelco trimmer I bought a year or so ago, this one is far better.  The Norelco had a vacuum built in but that made it too big and bulky at the head to trim under the nose, clean up the mustache, etc and it just didn't do a good job of getting stray hairs or reducing bulk.  To be fair, it was a bit different setup that did not have various trimmer heads like this Remington.  This trimmer is great.  Two speeds.  The main trimmer attachment works great for shaping and does a great job of reducing bulk using one of the attachable black combs.  I like the separate black ones better than the clear adjustable one.  Much easier to see what I'm doing with the smaller pop-on black ones.  The small detail trimmer is great for stray hairs under the nose and for trimming mustache along your upper lip and beard below your lower lip.  The little foil shaver didn't do much for me and I have not tried the nose/ear/eyebrow trimmer yet, as I don't have any bushes growing out of those areas yet and my eyebrows don't look like Abe Vigoda's.  I'm very happy with this trimmer and the price was great-about $32 with the 20% off coupon."
8/22/2018,Amazon,5,Great buy.,Just what we needed. Does just what it said it would
8/23/2018,Amazon,5,It's a good product and keeps a person looking tidy and trim.,"Perfect for trimming beard, mustache, inside nostrils, and inside ears.  It's a good product and keeps a person looking tidy and trim."
8/27/2018,Amazon,5,Five Stars,They work great just what I expected.
8/29/2018,Amazon,5,Great for ladies,"Use it to trim my bikini line and pit hair, high quality trimmer, more durable than women's products, and no gimmicks!~"
9/2/2018,Amazon,2,Battery will give out after 6 months,"Bought this item a few months ago. After about 4 charges, the battery gave out and it would malfunction repeatedly. The Trimmer would stay on for hours and would not turn off no matter how many times i pressed the power button. I would not purchase again."
9/4/2018,Amazon,5,You can buy replacement parts,It’s fast and easy
9/10/2018,Amazon,3,Great while it lasted.,Great while it was working. Tons of options. Died in a little under a year. Takes a charge but doesn't turn on.
9/12/2018,Amazon,5,Nice job Remington!,Quiet and works great
9/12/2018,Amazon,5,Great stuff,This works great to keep my beard looking clean and it also works well with other body hair
9/15/2018,Amazon,5,Great Buy,Got this on a deal during Prime Day. Works perfect for any part of your body...yes...any part...LoL
9/22/2018,Amazon,5,Perfect trimmer!,"My husband loves this and so do I! I bought this initially to trim the back of his hair when I give him haircuts, but he uses this to trim his beard down before he shaves. He was kicking himself for not thinking of getting one of these sooner. It’s the perfect little trimmer!"
9/23/2018,Amazon,5,This is the one.,"This is the third different trimmer that I bought in two months. The first two were brand names and expensive. The one pulled a few hairs out every time I used it, ouch. The second one didn't have the adjustments that I wanted. The Remington PG6170 cuts and trims very well and has an adjustable attachments that I like. I have a mustache and a goatee that I like to keep trimmed and the Remington does the job."
9/23/2018,Amazon,1,I hate this thing.,I purchased this hoping it could replace my current razor. Instead I got something inferior and that doesn't work that well. First of all it doesn't shave very close and leaves allot of patches and stubble. Second of all it doesn't allow you to clean the heads unless you unscrew the top with a screwdriver. Save your money and buy something else.
9/27/2018,Amazon,5,Awesome seller! Very honest!,Love it!
10/2/2018,Amazon,4,DIDN'T COME WITH CHARGER!,"After using it for months, it finally died on me. I went to see if there was a charger, but it didn't come with it... I love it trimmer, but how can you forget to put a charger in the box??"
10/3/2018,Amazon,2,Dangerous device!,It started turning itself on at random! I'm afraid to have it in the house for it might start a fire!
10/4/2018,Amazon,5,Great Deal Product Works as Described,great product works as described
10/5/2018,Amazon,2,Copper attachment head great. The other’s not at all.,"I liked how the copper head shaves, it is very smooth running and without any knicks or anything along those lines but that is pretty much the only good head on it. Any other attachment is trash! Especially the foil attachment for stubble shaving. If you’re trying to get smooth skin you may want to look toward another product."
10/9/2018,Amazon,5,Good,Good
